[
  {
    "venue_id": "VEN_BEVERLY_HILTON",
    "venue_name": "The Beverly Hilton",
    "venue_type": "Hotel",
    "street_address": "9876 Wilshire Blvd",
    "city": "Beverly Hills",
    "state": "CA",
    "postal_code": "90210",
    "max_seating_capacity": 1200,
    "first_hosted_year": 1959,
    "total_ceremonies_hosted": 12
  },
  {
    "venue_id": "VEN_BEVERLY_HILTON_HALL_01",
    "venue_name": "The Beverly Hilton - Pavilion 2",
    "venue_type": "Hotel",
    "street_address": "9876 Wilshire Blvd",
    "city": "Beverly Hills",
    "state": "CA",
    "postal_code": "90210",
    "max_seating_capacity": 1250,
    "first_hosted_year": 1959,
    "total_ceremonies_hosted": 12
  },
  {
    "venue_id": "VEN_BEVERLY_HILTON_HALL_02",
    "venue_name": "The Beverly Hilton - Pavilion 3",
    "venue_type": "Hotel",
    "street_address": "9876 Wilshire Blvd",
    "city": "Beverly Hills",
    "state": "CA",
    "postal_code": "90210",
    "max_seating_capacity": 1300,
    "first_hosted_year": 1959,
    "total_ceremonies_hosted": 12
  },
  {
    "venue_id": "VEN_BEVERLY_HILTON_HALL_03",
    "venue_name": "The Beverly Hilton - Pavilion 4",
    "venue_type": "Hotel",
    "street_address": "9876 Wilshire Blvd",
    "city": "Beverly Hills",
    "state": "CA",
    "postal_code": "90210",
    "max_seating_capacity": 1350,
    "first_hosted_year": 1959,
    "total_ceremonies_hosted": 12
  },
  {
    "venue_id": "VEN_BEVERLY_HILTON_HALL_04",
    "venue_name": "The Beverly Hilton - Pavilion 5",
    "venue_type": "Hotel",
    "street_address": "9876 Wilshire Blvd",
    "city": "Beverly Hills",
    "state": "CA",
    "postal_code": "90210",
    "max_seating_capacity": 1400,
    "first_hosted_year": 1959,
    "total_ceremonies_hosted": 12
  },
  {
    "venue_id": "VEN_BEVERLY_HILTON_HALL_05",
    "venue_name": "The Beverly Hilton - Pavilion 6",
    "venue_type": "Hotel",
    "street_address": "9876 Wilshire Blvd",
    "city": "Beverly Hills",
    "state": "CA",
    "postal_code": "90210",
    "max_seating_capacity": 1450,
    "first_hosted_year": 1959,
    "total_ceremonies_hosted": 12
  },
  {
    "venue_id": "VEN_BEVERLY_HILTON_HALL_06",
    "venue_name": "The Beverly Hilton - Pavilion 7",
    "venue_type": "Hotel",
    "street_address": "9876 Wilshire Blvd",
    "city": "Beverly Hills",
    "state": "CA",
    "postal_code": "90210",
    "max_seating_capacity": 1500,
    "first_hosted_year": 1959,
    "total_ceremonies_hosted": 12
  },
  {
    "venue_id": "VEN_BEVERLY_HILTON_HALL_07",
    "venue_name": "The Beverly Hilton - Pavilion 8",
    "venue_type": "Hotel",
    "street_address": "9876 Wilshire Blvd",
    "city": "Beverly Hills",
    "state": "CA",
    "postal_code": "90210",
    "max_seating_capacity": 1550,
    "first_hosted_year": 1959,
    "total_ceremonies_hosted": 12
  },
  {
    "venue_id": "VEN_BEVERLY_HILTON_HALL_08",
    "venue_name": "The Beverly Hilton - Pavilion 9",
    "venue_type": "Hotel",
    "street_address": "9876 Wilshire Blvd",
    "city": "Beverly Hills",
    "state": "CA",
    "postal_code": "90210",
    "max_seating_capacity": 1600,
    "first_hosted_year": 1959,
    "total_ceremonies_hosted": 12
  },
  {
    "venue_id": "VEN_BEVERLY_HILTON_HALL_09",
    "venue_name": "The Beverly Hilton - Pavilion 10",
    "venue_type": "Hotel",
    "street_address": "9876 Wilshire Blvd",
    "city": "Beverly Hills",
    "state": "CA",
    "postal_code": "90210",
    "max_seating_capacity": 1650,
    "first_hosted_year": 1959,
    "total_ceremonies_hosted": 12
  },
  {
    "venue_id": "VEN_SHRINE_AUDITORIUM",
    "venue_name": "Shrine Auditorium",
    "venue_type": "Auditorium",
    "street_address": "665 W Jefferson Blvd",
    "city": "Los Angeles",
    "state": "CA",
    "postal_code": "90007",
    "max_seating_capacity": 6300,
    "first_hosted_year": 1968,
    "total_ceremonies_hosted": 16
  },
  {
    "venue_id": "VEN_SHRINE_AUDITORIUM_HALL_01",
    "venue_name": "Shrine Auditorium - Pavilion 2",
    "venue_type": "Auditorium",
    "street_address": "665 W Jefferson Blvd",
    "city": "Los Angeles",
    "state": "CA",
    "postal_code": "90007",
    "max_seating_capacity": 6350,
    "first_hosted_year": 1968,
    "total_ceremonies_hosted": 16
  },
  {
    "venue_id": "VEN_SHRINE_AUDITORIUM_HALL_02",
    "venue_name": "Shrine Auditorium - Pavilion 3",
    "venue_type": "Auditorium",
    "street_address": "665 W Jefferson Blvd",
    "city": "Los Angeles",
    "state": "CA",
    "postal_code": "90007",
    "max_seating_capacity": 6400,
    "first_hosted_year": 1968,
    "total_ceremonies_hosted": 16
  },
  {
    "venue_id": "VEN_SHRINE_AUDITORIUM_HALL_03",
    "venue_name": "Shrine Auditorium - Pavilion 4",
    "venue_type": "Auditorium",
    "street_address": "665 W Jefferson Blvd",
    "city": "Los Angeles",
    "state": "CA",
    "postal_code": "90007",
    "max_seating_capacity": 6450,
    "first_hosted_year": 1968,
    "total_ceremonies_hosted": 16
  },
  {
    "venue_id": "VEN_SHRINE_AUDITORIUM_HALL_04",
    "venue_name": "Shrine Auditorium - Pavilion 5",
    "venue_type": "Auditorium",
    "street_address": "665 W Jefferson Blvd",
    "city": "Los Angeles",
    "state": "CA",
    "postal_code": "90007",
    "max_seating_capacity": 6500,
    "first_hosted_year": 1968,
    "total_ceremonies_hosted": 16
  },
  {
    "venue_id": "VEN_SHRINE_AUDITORIUM_HALL_05",
    "venue_name": "Shrine Auditorium - Pavilion 6",
    "venue_type": "Auditorium",
    "street_address": "665 W Jefferson Blvd",
    "city": "Los Angeles",
    "state": "CA",
    "postal_code": "90007",
    "max_seating_capacity": 6550,
    "first_hosted_year": 1968,
    "total_ceremonies_hosted": 16
  },
  {
    "venue_id": "VEN_SHRINE_AUDITORIUM_HALL_06",
    "venue_name": "Shrine Auditorium - Pavilion 7",
    "venue_type": "Auditorium",
    "street_address": "665 W Jefferson Blvd",
    "city": "Los Angeles",
    "state": "CA",
    "postal_code": "90007",
    "max_seating_capacity": 6600,
    "first_hosted_year": 1968,
    "total_ceremonies_hosted": 16
  },
  {
    "venue_id": "VEN_SHRINE_AUDITORIUM_HALL_07",
    "venue_name": "Shrine Auditorium - Pavilion 8",
    "venue_type": "Auditorium",
    "street_address": "665 W Jefferson Blvd",
    "city": "Los Angeles",
    "state": "CA",
    "postal_code": "90007",
    "max_seating_capacity": 6650,
    "first_hosted_year": 1968,
    "total_ceremonies_hosted": 16
  },
  {
    "venue_id": "VEN_SHRINE_AUDITORIUM_HALL_08",
    "venue_name": "Shrine Auditorium - Pavilion 9",
    "venue_type": "Auditorium",
    "street_address": "665 W Jefferson Blvd",
    "city": "Los Angeles",
    "state": "CA",
    "postal_code": "90007",
    "max_seating_capacity": 6700,
    "first_hosted_year": 1968,
    "total_ceremonies_hosted": 16
  },
  {
    "venue_id": "VEN_SHRINE_AUDITORIUM_HALL_09",
    "venue_name": "Shrine Auditorium - Pavilion 10",
    "venue_type": "Auditorium",
    "street_address": "665 W Jefferson Blvd",
    "city": "Los Angeles",
    "state": "CA",
    "postal_code": "90007",
    "max_seating_capacity": 6750,
    "first_hosted_year": 1968,
    "total_ceremonies_hosted": 16
  },
  {
    "venue_id": "VEN_CRYPTO_LA",
    "venue_name": "Crypto.com Arena",
    "venue_type": "Arena",
    "street_address": "1111 S Figueroa St",
    "city": "Los Angeles",
    "state": "CA",
    "postal_code": "90015",
    "max_seating_capacity": 20000,
    "first_hosted_year": 2000,
    "total_ceremonies_hosted": 22
  },
  {
    "venue_id": "VEN_CRYPTO_LA_HALL_01",
    "venue_name": "Crypto.com Arena - Pavilion 2",
    "venue_type": "Arena",
    "street_address": "1111 S Figueroa St",
    "city": "Los Angeles",
    "state": "CA",
    "postal_code": "90015",
    "max_seating_capacity": 20050,
    "first_hosted_year": 2000,
    "total_ceremonies_hosted": 22
  },
  {
    "venue_id": "VEN_CRYPTO_LA_HALL_02",
    "venue_name": "Crypto.com Arena - Pavilion 3",
    "venue_type": "Arena",
    "street_address": "1111 S Figueroa St",
    "city": "Los Angeles",
    "state": "CA",
    "postal_code": "90015",
    "max_seating_capacity": 20100,
    "first_hosted_year": 2000,
    "total_ceremonies_hosted": 22
  },
  {
    "venue_id": "VEN_CRYPTO_LA_HALL_03",
    "venue_name": "Crypto.com Arena - Pavilion 4",
    "venue_type": "Arena",
    "street_address": "1111 S Figueroa St",
    "city": "Los Angeles",
    "state": "CA",
    "postal_code": "90015",
    "max_seating_capacity": 20150,
    "first_hosted_year": 2000,
    "total_ceremonies_hosted": 22
  },
  {
    "venue_id": "VEN_CRYPTO_LA_HALL_04",
    "venue_name": "Crypto.com Arena - Pavilion 5",
    "venue_type": "Arena",
    "street_address": "1111 S Figueroa St",
    "city": "Los Angeles",
    "state": "CA",
    "postal_code": "90015",
    "max_seating_capacity": 20200,
    "first_hosted_year": 2000,
    "total_ceremonies_hosted": 22
  },
  {
    "venue_id": "VEN_CRYPTO_LA_HALL_05",
    "venue_name": "Crypto.com Arena - Pavilion 6",
    "venue_type": "Arena",
    "street_address": "1111 S Figueroa St",
    "city": "Los Angeles",
    "state": "CA",
    "postal_code": "90015",
    "max_seating_capacity": 20250,
    "first_hosted_year": 2000,
    "total_ceremonies_hosted": 22
  },
  {
    "venue_id": "VEN_CRYPTO_LA_HALL_06",
    "venue_name": "Crypto.com Arena - Pavilion 7",
    "venue_type": "Arena",
    "street_address": "1111 S Figueroa St",
    "city": "Los Angeles",
    "state": "CA",
    "postal_code": "90015",
    "max_seating_capacity": 20300,
    "first_hosted_year": 2000,
    "total_ceremonies_hosted": 22
  },
  {
    "venue_id": "VEN_CRYPTO_LA_HALL_07",
    "venue_name": "Crypto.com Arena - Pavilion 8",
    "venue_type": "Arena",
    "street_address": "1111 S Figueroa St",
    "city": "Los Angeles",
    "state": "CA",
    "postal_code": "90015",
    "max_seating_capacity": 20350,
    "first_hosted_year": 2000,
    "total_ceremonies_hosted": 22
  },
  {
    "venue_id": "VEN_CRYPTO_LA_HALL_08",
    "venue_name": "Crypto.com Arena - Pavilion 9",
    "venue_type": "Arena",